,Title,Flair,Score of Post,ID,URL,TimeStamp,Message body,#Comments,SubReddit
0,Lesson learned: do not share your net worth or any other specific financial information or goals with family or friends.,,8164.0,ixithd,https://www.reddit.com/r/financialindependence/comments/ixithd/lesson_learned_do_not_share_your_net_worth_or_any/,1600759554.0,"Do not tell your friends and family specific details like your salary, net worth, savings rate, etc, even if they ask. Its fine to talk personal finance and encourage people to also pursue FIRE. Share strategy and general goals, but don't go into your specifics. I wish I would have received this advice early in the FI journey. Money has suddenly become a contentious issue with a family member after that person asked me for a substantial loan. I never would have anticipated this person making such a request or being upset by my refusal. I greatly regret ever sharing my financial situation. ",1209.0,financialindependence
1,Top 10% control 88% stock holdings as of Sept 2019. Values are high flying during pandemic while the world plunges into chaos. Do you ever feel guilty?,,7161.0,hmeyjj,https://www.reddit.com/r/financialindependence/comments/hmeyjj/top_10_control_88_stock_holdings_as_of_sept_2019/,1594064671.0,"this post was posted and meant for r/financialindependence 
 I don't mean it to be on r/all.Stop reading if you are not from any of the FIRE groups.
----

As a FIREer, what is going for us is that majority of us who are more than half way there own large assets in stock market. I think a lot of us belong to the top 10%.

As the world plunges into chaos and unemployment is at sky high, a lot of us FIREers are making seriously good money in the stock market. If you re heavy on NASDQ index or FANNG stocks, you are killing it.

Does it ever cause a bit guilt in you that you are fairing so much better than the 90% population? That you don't even need to work and your portfolio is pulling in more money than average household income?

I do. I feel guilty. I work in asset management and I feel the whole stock market is so rigged that it's a way for the rich to enrich themselves. One of my mentors once told me that if you want to be rich, you own assets and businesses and hire others to do the work for you. One day, you will be making money while you are sleeping. I've dreamed to get there one day like him. And I did. But I have tremendous amount of guilt that I don't do shit and I make 6 figures a year just by sitting on FANNG and other Tech stocks.

Edit : Thx to kohox’s comment. Everyone should watch this video that really exposed how severe the America inequality has become. You should feel angry.

https://www.youtube.com/watch?v=QPKKQnijnsM


Here is the article as who own the stocks in America.
\[Edit\]: Moderator has asked me to remove the link so I will just show you the keywords to search. If you want to read it, just search for it. ""how america 1 came to dominate stock ownership""

Edit 2: If there is still anyone reading this. I was assumed to be 1) white 2) a man. That tells you the problems of this country. Just think about it.",1665.0,financialindependence
2,What FU money looks like as a healthcare worker,,5610.0,fmaynl,https://www.reddit.com/r/financialindependence/comments/fmaynl/what_fu_money_looks_like_as_a_healthcare_worker/,1584773501.0,"I'm a US nurse working in a US military facility overseas. My husband is active duty and stationed near me. We are debt free and have a year's worth of expenses in a liquid emergency fund. 

&#x200B;

My friends and colleagues in the US are telling me horror stories about how they do not have enough masks to take care of COVID patients. How for-profit hospitals are asking them to make their own masks, or, on the flip side, are threatening to fire them for bringing in masks from a personal supply. They are scared. They do not have the reserves to be able to quit, so they keep coming back to work, knowingly exposing themselves and their families when the organizations they work for could be making different (better) choices. 

&#x200B;

Earlier this month I was asked to do several unethical things regarding protecting Soldiers from COVID. Because I have the luxury of being in a place of financial security and working for an entity that has a notoriously hard time firing civilian workers, I dug in my heels and said hell no. Since that point, I've become even more vocal at work. FU money has given me the ability to protect those around me who have no say. If they fire me for doing what is right, my family and I will be okay.",468.0,financialindependence
3,"Is it just me, or is Rich Dad Poor Dad actually an awful personal finance book? Really don't know how it became a ""classic""",,5230.0,j6fyr2,https://www.reddit.com/r/financialindependence/comments/j6fyr2/is_it_just_me_or_is_rich_dad_poor_dad_actually_an/,1602026534.0,"The title is a bit harsh, but hear me out. I got really into personal finance and FIRE over the past say 2 years, mostly by reading Reddit and Investopedia. After reading so much about personal finance and investing online, I figured it was time to read some of the classic personal finance books. I started with Rich Dad Poor Dad because I hear it tossed around so much.

Now, I will start off with the positives about the book. I think from a mindset perspective, it's really actually quite good. Things that I think people should take more seriously are paying yourself first, knowing how to buy assets, having your money make money, optimizing assets, etc. All of this is great advice and certainly not enough people heed it.

My main frustrations from the book came from the specific examples that Robert Kiyosaki chose to give. Just to name some off the top of my head, here are a few things that he suggests over the course of the book:

* Dropping money in penny stocks and IPOs to make a killing (he cites one example of making an absurd amount of money off one... seems like selective hindsight to me)
* Picking up foreclosed houses to flip. Sure I bet you can make money this way, but certainly not great advice for the regular person
* Everyone should join a multi-level marketing company to learn how to sell. This one made me laugh... that is awful advice
* Investing in 16% tax liens. This one he even brings up an example of his friend calling him dumb and he is so smug about it when defending himself.

Those four were particularly bad, but I remember several others that made me scratch my head. I mean, the man acts like investing in a mutual fund is for someone who wants to live on rice and beans the rest of their life (to be fair though, I know low-cost index funds weren't as widely available / know about back when the book was written).

To add to the bad advice, it also annoyed me from a stylistic perspective that he acts like poor people are all as dumb as rocks and his cunning genius is why he's rich. I can only imagine the people who read his book and went out and joined an MLM and put all their money into tax liens and wonder why they never got rich.

In my opinion, this book should not be read by anyone who is planning on pursuing FIRE, there are so many better options.",727.0,financialindependence
4,"“Spend extravagantly on things you love, and cut mercilessly on things you don’t.”",,4389.0,l27w0g,https://www.reddit.com/r/financialindependence/comments/l27w0g/spend_extravagantly_on_things_you_love_and_cut/,1611263482.0,"The above quote is my favorite advice I’ve heard from the FI community. It’s helped me achieve financial stability and growth while truly enjoying life (something that can be hard when aiming for a super high savings rate). 

Things I spend on without beating myself up: travel, tattoos, yoga, my partner, my cat, and renting a decent place for myself. These things bring me legitimate joy. 

Things I mercilessly cut spending on: clothes, restaurants/bars, furniture, cars, and new tech/devices. These things don’t really affect my happiness. 

You may have completely different priorities than 
me, and that’s great! My point is just to make it clear what you care about, and allow yourself to direct money that way. Even though I spend on things I love, my monthly spending has taken a nosedive by saving on things I don’t care about.

Much love to you all!

Edit: Wow thank you for the love and awards on my first-ever Reddit post. As many of you pointed out, the quote is from Ramit Sethi, author of I Will Teach You To Be Rich. I also wanted to clarify that “extravagant” doesn’t necessarily mean “luxury.” When I say I spend extravagantly on things, I still do so responsibly. Example: I love travel but that doesn’t mean I book first class tickets and five star hotels. It means I travel cheaply so I can afford more trips throughout the year. It’s all about forming a positive and honest relationship with yourself 🖤",541.0,financialindependence
5,"Has anyone made the mistake of disclosing to someone (a trusted friend, mind you) that they are in a good place financially and then regretted it?",,4276.0,h7pvr8,https://www.reddit.com/r/financialindependence/comments/h7pvr8/has_anyone_made_the_mistake_of_disclosing_to/,1591985360.0,"In my case I received a pretty significant inheritance and my friend knew the relative who passed away was well off and asked if I had gotten an inheritance and when I told her that I had, she kept throwing out ballpark numbers until I indicated which range it was in. She then gave me  all kinds of “advice” about quitting my job, leaving my husband and getting a grotto installed at my home. As if all of that wasn’t obnoxious enough, now simple texts that shouldn’t involve $$ now do. Example: We’re going on a road trip soon and instead of asking if I’d be willing to drive, she sends this: “Any chance we could take your car but I drive?  I get so car sick if i don’t.  Mine has 160,000 miles on it and I still owe $13,000 - so the less I drive it on trips the better.” I’m worried that her knowledge of my finances will forever taint our friendship and I don’t know if there’s anything I can do about it.

Edit: I absolutely don’t mind her driving my car and not using hers, that’s truly not an issue! It just seemed a bit odd that she threw the balance of the loan into it. I can’t recall a time when making driving arrangements with a friend anyone had mentioned how much they owe on the car. This could all be my totally warped perspective, but I immediately felt like I needed to offer to pay it off for her or something. The good news is, I didn’t!

Edit #2: She just asked me to co-sign on a $30k loan for a pool for her. :|",906.0,financialindependence
6,[2 year update] 38/m/single. $2.3 million. Submitted my resignation letter today. Thank you guys for the encouragement all these years.,,4111.0,gwhxgh,https://www.reddit.com/r/financialindependence/comments/gwhxgh/2_year_update_38msingle_23_million_submitted_my/,1591279058.0,"Hi, r/financialindependence. I'm the guy who quit his job in the US in June 2018 with naive dreams of frugally solo traveling the world by air, frugally solo traveling North America via van camper and spending more time with my friends and family in between.

Background: I'm 40 now, ethnically Chinese guy in Texas. I started working in my early 20s after getting out of grad school. Salary varied anywhere from $70,000 to $130,000 during those 14 years or so. I live in a state with low cost of living and no state income tax, so I knew when I started that I could save a majority of my income if I stayed frugal and resisted lifestyle inflation. I live in the same starter home I bought around 2010 and drive an old Camry. I did a bunch of set-it-and-forget-it buying of large cap US index funds and Berkshire Hathaway and I did some individual buying of large cap bank and technology names before and after the Great Recession ten years ago.

I spent my first year in Thailand, I accepted a non-paid, volunteer teaching position with a Ministry of Justice program there that teaches English and job skills to low-level convicts and former prostitutes. Click my previous thread below to get a breakdown of my expenses and experiences living in Bangkok, traveling weekends through SE Asia on dirt cheap airfare costing as little as $20 a flight sometimes, the cheap street food and so forth.
https://old.reddit.com/r/financialindependence/comments/bk1rco/1_year_update_38msingle_23_million_submitted_my/

My monthly expenses came out to about $850 with free housing. Would have been up to $1,350/month if I got a fancy flat and paid my own utilities, which is still crazy cheap by western standards. That includes heath insurance, eating out every meal, mass transit/taxi fare and spending money for shows and nicknacks. My net worth increased from $2.3 million from when I quit to $2.6 million when I came home from Thailand one year later, entirely from paper stock gains.

Year 1 went almost 100 percent according to plan. The first six months of Year 2 did, too. I took separate trips from the US to the UK, Spain, Mexico, Florida, New York and Minnesota, all on heavily discounted fares. Because when you're retired, you can take all of the odd-hour fares discounted at over 60-70 percent off, right? I stayed with friends, got cheap Airbnbs or used my hotel points to cut costs. It was great.

2020 comes and COVID-19 hits. My trip to Taiwan and Hong Kong was cancelled. A trip to Italy soon after, too. Then separate trips to Nevada and Boston, too. My net worth skyrocketed to over $3 million thanks to the post-China trade deal rally and the market assuming COVID-19 is contained. The abrupt, panicked selloff as the world went into lockdown knocked me back down to $2.1 million. Painful, but I rode the Great Recession all the way down and back ten years ago, so I had that experience to rely on to resist panic selling. I've since rode the April/May rally back up to $2.6 million.
https://i.imgur.com/Wg7c74L.jpg

My current expenses ... I own the house outright so no rent is great. Health insurance is covered by my old employer (while still in SE Asia, I was offered a remote work job by my old boss, like set aside 60-90 minutes a day to answer email and have him bounce ideas off of me. I originally said no but was swayed when told I could get health insurance covered and my 401k matching when I moved back to the states, have done it since. A nice side hustle for a fraction of my old salary.)

* $480 a month for property taxes and home insurance. That's right, per month. Property taxes are high here, the joys of home ownership.

* $70 a month for auto insurance, two cars, two drivers.

* $130 gasoline and auto maintenance. They're Toyotas, maintenance is really easy and the engines will run forever.

* $220 water, internet and power.

* $120 a month for four smartphones on a Sprint family plan. Yes, Sprint sucks but it's a great price that I've been grandfathered into for several years. I get a free Hulu sub and a free AAA sub with it, too.

* $140 groceries. I shop mostly at Aldi and grow several greens and fruits in my backyard.

* $60 for random upkeep around the house. Replacing a broken sprinkler head, buying wood chips, replacing a broken weedeater guard, batteries, light bulbs, buy a bag of potting soil, stuff like that.

= $1,220/month. I'm not including eating out or going to shows or movies because I'm inside the house all day every day. My $20 gym membership is suspended, I don't want to work out in an enclosed space until there's a vaccine or proven treatment.

Plans for Year 3 are wait out the pandemic for a vaccine or treatment. Stay home in the meantime. I miss flying. I fully expect flying to be a more miserable experience with less competition and higher prices when is does bounce back. It's unavoidable, I get it.

I'm still looking at a van to custom build a camper for one to travel to state and national parks in. I've ridden in my friend's Sprinter a few times and I'm now convinced it's too much room for one person. I've also decided that a camper van with on-board water, shower and toilet is unnecessary for me, I can just use a Planet Fitness membership or pay for showers at truck stops or campsites. The custom builds being offered for Nissan NV200 cargo vans with pop-top roofs are intriguing. Would cost about $23,000 for a new NV200, then another $20,000 to $30,000 for the camper build.
https://www.youtube.com/watch?v=VLVcZpmuzMs

I am also intrigued by the ""camper mode"" being offered in the Tesla Model 3. It basically allows you to run the car's AC all night without killing the battery, meaning a climate controlled room. The backseat can be folded down and you have a completely flat floor to lie on, with your legs in the trunk of the car. Third-party vendors now sell mattress and bedding kits for you to use to sleep in the back of your Tesla all night, it's amazing.
https://www.youtube.com/watch?v=KjC_ggNqbWA

Big drawbacks to a Model 3 for a ""camper"" is the lack of space and the sparse Supercharger network. We'll see, I'm in no rush. $38,000 for the standard range 250 miler. $43,000 for the 320-mile version.",396.0,financialindependence
7,Truck Driver: I will achieve financial independence and retire early by 2026. At age 30,,4039.0,iscqef,https://www.reddit.com/r/financialindependence/comments/iscqef/truck_driver_i_will_achieve_financial/,1600052667.0,"I’m making this post mostly for myself so I can come back and look back at it in a couple years and also to inspire others in similar situations.

A little backstory: It was the year 2018 and I was a lost 22 year old that was going to community college because I thought there was no other way to get out of lower/middle class. I was attending full-time community college, while also working 50-60 hours a week as a full-time uber/lyft driver. I was making around $250-$350 / week after car expenses. I was basically wasting my time since I had no time to myself and was working just to pay the bills. One day I was driving, my brother texts me a book that I should listen to while driving. The book was called “Rich dad poor dad”. I listened to it and all the information went in the left ear and out the right ear without registering because I was too stressed from attending college and working full-time. 2 months or so go by and I start watching youtube videos on (FIRE) financial independence, retire early. I liked the idea but 99% of the people I watched had all these high paying jobs and right then that idea seemed impossible. Im stressed out again.

Around June, 2018 one night something clicked in my head that I can retire at a early age if I leave the united states and move to a low cost of living country. Since my parents were from India and I was raised in India and came to U.S at the age of 9. I would be very comfortable living there without any issues. I knew the cost of living there is so much cheaper than in the united states and I can retire early at age 30 if I really wanted to. I started doing my numbers to see how long and how much money invested it would take for me to achieve these goals.

As I became more invested in this idea, I decided not to continue my education after community college because I didn’t want to take out student loans that will eventually put me in the rat race where it would be difficult for me to get out of financially. Plus, I was only going to college for money. I started doing more research on careers that pay high income without a college degree and came across on-the-road trucking. At this point, I did not care how hard my life might get because I was set on one goal and that one goal was to retire by age 30 out of united states to a low cost of living country like india. In June 2018, I decided not to continue my education and instead went to go get my CDL Class A license. 

I got my license, got my 2 weeks of training and then drove for a company until August 2019. I saved up every penny after food expenses since I was living out of the truck. In August 2019, I purchased my own truck/trailer and got my own authority to become my own boss on the road. This is the month where my real journey starts. I have been Trucking with my own authority for almost 1 year and lived out of my truck and only went home to see my family couple times a year. I have cut out 99% of my expenses. No car, no debt, no mortgage, no rent and the only thing I have is food expenses and Netflix account and my truck/trailer payment. I finally saved up a good chunk of money that I am ready to buy my first real estate investment property cash. 

So far, my plan is perfectly on track and I should be able be able to retire at the age of 30 without a college degree. 

My numbers:

Current Age: 24

My FIRE number: $1000/month but I am going for fat fat fire and shooting around $4000. Even $2000 is close to impossible to spend in india a month. 

My pay: $260,000 / year gross and around $123,000 net after all expenses. I own my truck and trailer and have my own authority.

I am planning on buying 1 real estate property cash every other year and rent the property out. I mostly look for 9-14% ROI. I am currently looking at properties and waiting for the right one to come on the market.

In 2026, I will have 4 properties that I bought foreclosed at around $130,000-$150,000 price range and which will now be worth around $200,000 fully paid off and all rented out bringing in $4000 passive income and at that time, I should be able to leave the country and live my life freely in india and also travel the world because there is no way I’m spending any where near $4000/month in india. I will have property management company that will look after the properties and I will be available on call if I am needed. 


Sorry, if this was a long post but its mostly for myself to come back and look at it years down the road :)",662.0,financialindependence
8,Went full FIRE today,,3704.0,itmbmz,https://www.reddit.com/r/financialindependence/comments/itmbmz/went_full_fire_today/,1600220778.0,"[Previous Post](https://www.reddit.com/r/financialindependence/comments/gkpoom/fi_on_my_birthday/) in May. 

Today was my last day of work.  I ran the numbers and retired with $3.23 million CAD against a target of $3 million.  Target withdrawal rate is $100k / year.  

I hit the $3 million FI number 4 months ago today.  I planned on retiring on Aug 15, but due to uncertainty in the market and a bit more equity coming in today, I decided to push retirement out one month. 

All my goodbyes were virtual (as well as all work for the last 6 months),   I explained FIRE to a few people, they seemed interested but confused and a bit skeptical.  

I am really looking forward to the future, but it seems surreal to not be concerned with work or an external force driving my schedule.   I have worked full-time for 23 years, and was in school full time for 19 years before that.  Tomorrow is the first day of the rest of my life.  

Finally, I am going to have a few drinks to celebrate, so I won't reply until tomorrow morning.  Cheers!",635.0,financialindependence
