,Title,Flair,Score of Post,ID,URL,TimeStamp,Message body,#Comments,SubReddit
176,I Tracked Every Dollar I Spent for 10 Years!,,871.0,khkcxi,https://www.reddit.com/r/financialindependence/comments/khkcxi/i_tracked_every_dollar_i_spent_for_10_years/,1608567134.0,"
[Click here to see my 2020 financial summary](https://i.imgur.com/uJZPkfw.png)

Hi all! I’m back with my annual update – 10 YEARS! First decade down. [Here’s the latest version of the spreadsheet I made](https://drive.google.com/file/d/116ujdZh5sw266f2l4zTGgX964Ri4jeQ5/view?usp=sharing) to budget my spending and [here are instructions](https://imgur.com/a/p6y9Z) for how to use it. Shout out to everyone who has helped me debug this along the way. See you next year!

FAQ

- *How is this not a pain?* It’s actually pretty easy. The trick is not to track the money at the point of every individual purchase. Instead, create separate checking accounts for different types of expenses and simply track how much money you put into each checking account per month

- *Job?* Active Duty US Space Force Astronautical Engineer

- *Education?* MS Astronautical Engineering, BS Mechanical Engineering

- *Age?* 33

2020 YEAR IN REVIEW:

- Invested 52% of my net income (target was 45%)

- Spent 24% of my net income on recreation/fun (target was 25%)

- Spent of 24% of my net income on living expenses",502.0,financialindependence
177,Did free cash drive people to quit work? Not according to a new study of Ontario’s basic income experiment,,871.0,fe26z3,https://www.reddit.com/r/financialindependence/comments/fe26z3/did_free_cash_drive_people_to_quit_work_not/,1583442740.0,"https://www.thestar.com/amp/news/gta/2020/03/04/did-free-cash-drive-people-to-quit-work-not-according-to-a-new-study-of-ontarios-basic-income-experiment.html



I posted this article because I feel like it parallels one of the main benefits of FI – More freedom to pursue jobs and activities that you deem as higher value.

 

To briefly summarize, there was a pilot project in Ontario that saw roughly 4000 people receive universal basic incomes (UBI) over the course of 13-17 months.  It would have been a 3-year study, but the provincial government decided to scrap the program half-way through.  So take the results with a grain of salt.  That said, the items that stuck out as most interesting were that:

 

1. Three quarters of people continued to work while receiving UBI.  

What does this tell us?  It could mean that these people derived value other than money from their jobs.  However, I'd say it's difficult to definitively conclude that since participants were aware that this was a short-term study and that after 3 years, the UBI would stop.  Work would be necessary for them once the UBI stopped, and if they quit their jobs now, they'd be three years ""behind"" in their savings/careers.  The amount of UBI paid (generally $17k CAD /year per person, $24k CAD /year for couples) may have also been a factor as to why most participants continued to work.
 
 
2. Of the three quarters of people who continued to work, more than one third were able to move to higher paying and more secure jobs.  

This to me is the most telling.  It seems like these people were able to take more risks in their jobs to move to better positions, or were able to leave precarious/toxic jobs and move onto something better.  Anecdotal accounts of that are within the article.  I think this is the point that mirrors FI the most.  Without having to worry about your next paycheque as much, you have more freedom to explore your ""highest and best use"", or at least find better employment.  You're no longer beholden to a bad job.  I've seen members on this subreddit express the same sentiments – freedom to find better employment since money is no longer an incumbrance.
 

I'd be curious to get people's views on this article, or UBI in general.  How would UBI impact FIRE, if at all?",352.0,financialindependence
178,Vanguard - How America Invests 2020,,867.0,k60cbv,https://www.reddit.com/r/financialindependence/comments/k60cbv/vanguard_how_america_invests_2020/,1607012585.0,"Interesting analysis on the habits of the five million retail (personal) investors at Vanguard.   
The good stuff (data and graphs) is in the PDF linked at the end. 

[https://investornews.vanguard/introducing-how-america-invests/](https://investornews.vanguard/introducing-how-america-invests/)",524.0,financialindependence
179,Wonder how the Real Estate FIRE folks are doing.,,858.0,fp1bp1,https://www.reddit.com/r/financialindependence/comments/fp1bp1/wonder_how_the_real_estate_fire_folks_are_doing/,1585181142.0,"[U.S. Retailers Plan to Stop Paying Rent to Offset Virus](https://www.bloomberg.com/news/articles/2020-03-24/u-s-retailers-plan-to-stop-paying-rent-to-offset-virus-closures)

&#x200B;

With stores closed, retailers can't pay rent. On top of that, retail employs a massive amount of people, many of them renters themselves. If these workers are not getting paid, I imagine they can't pay their rent either. However, Real Estate fixed expenses are not going away (mortgages, taxes, maintenance, depreciation, etc..)

Curious to see what are the thoughts of the Real Estate FIRE on the current situation specially the ones who used leverage to buy properties and generate cash flow.",388.0,financialindependence
180,A timely reminder: The roller-coaster ride and COVID-19: A timely reminder,,862.0,favlgi,https://www.reddit.com/r/financialindependence/comments/favlgi/a_timely_reminder_the_rollercoaster_ride_and/,1582900550.0,"Most of us have heard about the stories of your fortune being cut in half, the gruesome effects of a bear market, and the panic. The last few years have shown us the beauty of financial independence; now, we might be confronted with one of these tests of our nerves.

This is just a friendly reminder: 

It seems that the time has come, where the market is (and might for a while) be taking a hit. The surrounding conditions (COVID-19) aren't really pretty, but keep in mind this is what we ""read and studied"" about, discussed, and ultimately ""trained"" for. Let the markets do their thing, stick to your plan, follow the rules your country has for the ""surrounding conditions,"" and whatever you do, **do not panic. This is the roller-coaster ride we all agreed to join to have a happier life. Small-time changes in our surroundings shall not influence our long-time goal.** 

I hope this helps.",445.0,financialindependence
181,"Is ""I'll just go back to work if the stock market collapses"" still a realistic plan B for FIRE?",,852.0,fki9td,https://www.reddit.com/r/financialindependence/comments/fki9td/is_ill_just_go_back_to_work_if_the_stock_market/,1584499278.0,"A fairly common (but not universal) belief among FIRE advocates is that earning money once you are retired is easy. That you can always go back to your old career, or monetize some hobby, or get a part-time job doing something you love, or (at the very least) start driving for Uber.

Mr Money Mustache is probably the prominent advocate of this line of thinking. 

>Kentucky normally processes 2,000 jobless claims a week but received more than 9,000 claims on Tuesday alone.

Given we're currently in a largish market crash, how many people are looking around right now thinking, ""Yeah, this would be a good time to look for a job if I were retired?"" Are there any recent retirees considering going back to work? What work are you considering going back to?",363.0,financialindependence
182,"Blasted past ""FI #,"" still employed, loss of ambition/motivation?",,854.0,k4o0dq,https://www.reddit.com/r/financialindependence/comments/k4o0dq/blasted_past_fi_still_employed_loss_of/,1606839503.0,"My wife and I have eclipsed our $2.5mm investment goal and now stand at $3.5mm invested.  Our spend would be about 2.5% of our nest-egg at this point.  This does not include the value of my $27k per year non-COLA pension which will kick in at age 65 (that's 17 years from now, God willing).

By any discernible measure, we could spend our days doing whatever we wish, which was the motivation for FI in the first place.  Yet, our respective grinds continue.  Neither of us are particularly enamored with our work but are highly competent and thus paid well.

We ratcheted down our lifestyle a while back ""to hasten FI"" ...  which flat out sucked.  So, we ratcheted up our lifestyle again ... which has been great and a return to normalcy for us.  And, 2.5% SWR is where we presently stand, even after re-inflating our lifestyle.

I am beginning to wonder if I, specifically, have some mental hurdle that I will never clear.  I daydream about hiking national parks, reading, oil painting, learning a new instrument or volunteering my time for financial literacy causes.  Instead, I find myself making (SUPER) dull drives across the Midwest, making sales calls and staying in Marriott Courtyards.  The corporate minions are pleased but, more and more, I am not.  It is as though I am experiencing an inverse relationship between our net worth and my job satisfaction and, in turn, my general happiness.  

To change things up with work, I recently moved to a sexier division (more attractive technology) and this does not seem to be hitting the mark either.  It is the same game with a different widget and a bigger paycheck.  It is exceedingly difficult to stay motivated when we have already won the game.

If anyone has been in a similar situation then I am all ears.  How did you get off of the hamster wheel?   
 I do not believe I will ever fully retire but why I keep the golden handcuffs firmly attached in a high-stress field is officially beyond me at this point.",326.0,financialindependence
183,Achieving guilt-free spending,,844.0,ha99tj,https://www.reddit.com/r/financialindependence/comments/ha99tj/achieving_guiltfree_spending/,1592330908.0,"I'd like to make the case for ""fun money"" as a budgetary line-item, rather than relegating it to ""whatever's left over."" Many folks here probably do that already, but it's not as common as I expected. We have a lot of discussion in the daily threads about guilty pleasures, purchases that are/aren't worth it, the value of vacations, and so forth.

I grew up, ""we can definitely buy food but we if the car breaks again we'll lose the house,"" lower-middle class. For my early adult years, I experienced intense guilt whenever I made any kind of purchase. Surprisingly, this didn't go away once I broke into earning six figures. Non-stop buyers' remorse, even over good purchases. The guilt of a $30 brunch negated any enjoyment of such a luxury.

**Eventually, I created a checking account exclusively for guilt-free spending.** Every paycheck, I automatically put $X into it. When I got raises, I would funnel 80% of the raise into savings/investment accounts and 20% into the lifestyle/fun-money account. Managed lifestyle creep.

Now, I feel zero guilt when I buy things from that account. It's factored into my FIRE plan, after all. It's part of the budget, just like vanguard, just like monthly bills. Fancy cocktails? Zero guilt. New phone? Gravy. All-inclusive vacation with my wife? If the account stays > $0, we could afford it.

If you find your enjoyment of purchases diminished because you question whether or not you should have saved that money instead, I'd encourage you to try this method. You will spend exactly as much as you are comfortable spending and you'll enjoy the results more as well.",206.0,financialindependence
184,Anyone get the feeling of just wanting to take a break till the economy bounces back?,,843.0,i5bzqc,https://www.reddit.com/r/financialindependence/comments/i5bzqc/anyone_get_the_feeling_of_just_wanting_to_take_a/,1596799122.0,"I am following FIRE and have assets mainly in cash and the stock market. This question is intended specifically for this subreddit where people have some kind of ""fuck you money.""

I was an independent consultant for the last two years and when COVID hit, my last contract ended. I saw the writing on the wall from my other freelancer friends who were not getting new work anymore, and joined a company as an employee. Luckily I was able to do that pretty quickly. However the company is also not doing well and I am under a lot of pressure. Sure I am learning a lot but its like a sink or swim environment and I am not sure I will be able to swim long enough. 

With the economy slowdown, is anyone entertaining thoughts of just getting out of the rat race for 2020 and hope for better times in 2021? 

The two main concerns I have for this are:  

* Who knows whether the economy will bounce back by 2021. It could still be the same scenario only I am now more desperate for work.  
* Explaining the gap. Easier to do when you're self-employed for sure.  

Also, another point is that I can't really move to Thailand or Cambodia to ride out the winter in a LCOL country. Maybe this will change in a month or two.  

Your thoughts?",384.0,financialindependence
185,My Mega Backdoor Roth setup experience with Fidelity,,841.0,f2kgq1,https://www.reddit.com/r/financialindependence/comments/f2kgq1/my_mega_backdoor_roth_setup_experience_with/,1581477076.0,"Me and my wife make more than 200k$ a year, so we don't qualify to contribute to Roth IRA. We were basically maxing out 401ks then sending everything else to our taxable Vanguard account.

I was always curious about the Mega backdoor Roth i.e a way for high income individuals/couples to contribute money to Roth so that it can grow tax free. Today I finally had time to research if my company offered this (thankfully they do!) and I set it up with Fidelity. I learnt a few things so I thought I'd share my experience with you guys:

Fidelity doesn't let anyone set this rollover on their own via their website etc. You need to call them to make any kind of change to your after tax contributions' rollovers. There are two ways of doing this.

1. You will have an after tax contribution option in your Fidelity account, if your employer allows you to contribute to after tax. You can contribute to this after tax, then call Fidelity periodically and ask them to move this your Roth at any time you want. IRS limits your pre tax contributions(19,500) + employer contributions + after tax contributions to 57k. So you can contribute (57k - 19.5k - employer contributions) as after tax contributions.

2. The problem with option 1 is that, any growth/dividend accumulated in the period between after tax contribution and the time you call Fidelity to roll it into your Roth 401k is taxable. Also calling them each time is a chore. To avoid this, you can call Fidelity to setup any after tax contributions to automatically be rolled over to your Roth 401k immediately, so that the gains are not taxed. The official term for this is ""automatic roth in-plan conversion""


EDIT: Adding/editing a few things I learned from this thread, for the year 2020:

1. I mistakenly assumed that my only option was the mega backdoor roth after maxing out my 401k, due to income limits. You can also open a traditional IRA, contribute 6k to it, then convert this to a Roth IRA - provided you don't have any other IRA. This is called backdoor Roth and can be done by anyone irrespective of employer. On top of this, if employers allow, you can do the mega backdoor roth which is what this post is about. So this brings the total tax advantaged contribution amount possible to 57k(pre+post tax via 401k) + 6k (via traditional IRA to Roth backdoor) + 3550 (HSA)

2. You can rollover your after tax 401k megabackdoor contributions to a Roth IRA or Roth 401k. Looks like rolling over to Roth IRA can to be done only manually each time. Rolling over to Roth 401k can be done automatically, if that is part of your employer's plan offering. The advantage of rolling over to Roth IRA is that you can access the contributions any time. You can only access the contributions from the Roth 401k when you leave your employer. In either case, accessing the contributions are tax free. In either case, accessing the gains will be tax/penalty free only by age 59.5. Before that, to access gains, you have to pay tax + penalty.

Hope this helps",284.0,financialindependence
186,FI people with adult children - how are they doing financially?,,833.0,ktxls4,https://www.reddit.com/r/financialindependence/comments/ktxls4/fi_people_with_adult_children_how_are_they_doing/,1610220686.0,"I am trying to teach my 13yo about how money works and the importance of saving and investing. She gets money from a few sources, including a weekly allowance, gifts from relatives, and a small amount from working in my business. I require her to save 30% of everything she receives, which goes into her savings account. I show her how the account is growing, and I told her that once it gets to $3,000, she can invest it in the stock market (mutual fund).

Still, I'm not sure that this is making any sense to her. Does anyone have any success or failure stories when it came to teaching your now-grown children about money?

&#x200B;

Edit: THANK YOU SO MUCH for all your advice, experience, anecdotes, snarky replies and funny stories! After reading every comment, these are the takeaways that will shape my next steps:

&#x200B;

1. Some people (or their kids) ""got it"" (saving and investing) at a young age - like kindergarten. Others got it in their 20s or later. Some said their kids still haven't gotten it. I conclude that, for my daughter, investing for the long term is probably too abstract at her age.
2. A LOT of you gave incentives/were incentivized to save (e.g. like matching savings) and make money (chores or jobs). There were a couple examples of the bucket system and games. One person mentioned charity. Great idea.
3. Many of you taught or learned through example, and said kids are ""always watching"" even if it isn't readily understood at the time. Not just finance stuff.
4. It is better to teach than to not teach. There is a risk of backfiring or it may not have any effect at all, but many wished their parents had guided them when they were young.
5. On a technical note, some questioned the $3k investing threshold. I was still stuck in the Vanguard minimums. When the time comes, we'll look at ETFs.
6. There are a lot of resources for teaching kids about money. Books and YouTube.

Given the above, I've decided that first I'm going to show her how to budget the money she has and will be receiving in the near future (like allowance). Investing was just putting the cart before the horse so to speak. I talked to her about budgeting yesterday, and she showed me a note she keeps on her phone. It lists her current savings and money coming in. So that was good. I'm also going to kill two birds with one stone and show her how to use Google Sheets. Will be good to keep track but also to teach her about spreadsheets in general (not just for finance). She's also focused on saving up for a new phone,  so that can ""anchor"" the lesson. 

Next, I'm going give her some incentives for saving. Not sure exactly what yet, but something like matching 50% of the savings she's accumulated by each birthday (Initially I wanted 100% but my wife laughed and said that by high school we might owe her all of our money lol).

Finally, I need to be a bit more aware of my own habits. There were a couple times when she didn't have any money with her and I had to loan her $5 or so until the end of the day. I'm going to stop doing that for the most part. Also, I owe her some money for gift cards that I bought from her, but I've been letting it float for too long. Kids are watching, right?

Actually just a couple more things about what I ""read into"" many comments. There is a LOT of love (sometimes tough love) passed from parents to their kids through money lessons. Parents have done what they can, but also stressed that kids need the freedom to make their own mistakes. Hearing all these stories was very encouraging. Kudos to the FI community!

&#x200B;

&#x200B;",427.0,financialindependence
187,I was supposed to FIRE right around NOW,,833.0,gczbku,https://www.reddit.com/r/financialindependence/comments/gczbku/i_was_supposed_to_fire_right_around_now/,1588543823.0,"Welp, many of you have said that real estate income or small business income shouldn't be counted as part of your FIRE number. I kinda took offense of that notion in the past. I thought to myself that if I save enough to encounter 10% vacancy, have a healthy reserve, I should be OK. Who would knew this Pandemic just threw all of these conventional RE wisdom in the trash.

A huge part of my post FIRE income would have come from my real estate investments. It's totally rocky right now with very uncertain future due to the shutdown. But I am still hoping for the best.

I did take this sub's recommendation and built a pretty sizable Cash/Bonds/Stocks mix. FireCalc showed that I have a 98% success rate to live off that stash for 20 years without any additional income.  I am in my early 40's. And yes, I am counting on some SS and a sizable ""inheritance"" (It's a house I bought for my parents in the 90's. It's paid off. I still own it.)

Since this pandemic, I took an unpaid leave from my job and it suppose to end after 3 months. It has been 6 weeks without any work and I am feeling the best!!!

I don’t have to do the stupid daily stand up to report to the higher being what I have been up to.  No more nagging emails from HR, my boss, compliance and IT department. ZERO stress! I get up every morning to have coffee and breakfast without getting rushed, situate my kid to the remote classroom, read news on my computer, go for a little nice walk, have home made lunch, take a nap, do a workout, watch movies, bake a dessert with my kid… Wow, I didn’t know life can be this good. The dreadful feeling that eventually I still have to return to work really puts me down. If only if I could count on my RE investment, I would have pulled the trigger with no hesitation.

Some FIRE folks said that it doesn't have to be 0% or 100%. Deep down, I really want to just take a chance. I am good for 20 years at least using my savings. My real estate income didn’t go down to 0 even in this hellish climate. 

What if I don't live very long? That would sucked real bad if I die prematurely. Maybe I should just take a chance and live a little. Humans are extremely resilient. We change, adapt and survive. It doesn't have to be one formula fits all.",262.0,financialindependence
