,Title,Flair,Score of Post,ID,URL,TimeStamp,Message body,#Comments,SubReddit
121,Financial Independence nearly 100 years ago!,,1191.0,hf2mdf,https://www.reddit.com/r/financialindependence/comments/hf2mdf/financial_independence_nearly_100_years_ago/,1593011196.0,"Accidentally came across this and thought it was pretty cool. Popular Science article from 1926 on becoming financially independent in 15 years investing $100/month.

I found it interesting that inflation adjusted, $100/month then is \~ $18,000 year now - mighty close to 401k limits. Also, it uses a 6% return as an example. In their case, they talk about using bonds but that's pretty much the same rate people target today in a balanced portfolio.

Plugging in to inflation and compound interest calculators, they're talking about the modern day equivalent of getting to $440,000 in 15 years, or \~ $17,000/yr at 4% rule. Within striking distance of leanFIRE!

[https://books.google.com/books?id=wikDAAAAMBAJ&lpg=PA4&pg=PA4#v=onepage](https://books.google.com/books?id=wikDAAAAMBAJ&lpg=PA4&pg=PA4#v=onepage)",121.0,financialindependence
122,Taking a year off from an employer’s perspective,,1192.0,h9r3te,https://www.reddit.com/r/financialindependence/comments/h9r3te/taking_a_year_off_from_an_employers_perspective/,1592262376.0,"I recently saw u/dmmagic’s [post](https://www.reddit.com/r/financialindependence/comments/h95fha/have_any_of_you_taken_a_year_off_saving_for/?utm_source=share&utm_medium=ios_app&utm_name=iossmf) and figured I’d share a bit of a different perspective I haven’t seen on this subreddit before. 

One of my parents was recently hiring and someone came in with a two year gap on their resume. During the interview, he explained that he had taken a temporary early retirement since he could. Neither of my parents had ever heard of this and both thought it was ridiculous when we talked about it at dinner. I introduced them to the ideas of the FI movement since it seemed pretty obvious to me that this guy was a part of it. They’ve been asking me a lot about FI ever since which is pretty cool. That said, they were also worried he might just decide to walk out one day as well.

People here regularly talk  about others not understanding FI when discussing budgets, lifestyle, etc. but I haven’t send much on coming back to work after an early retirement. Many hiring managers don’t know about FI. My parents immediately assumed it was a lie to cover up for the inability to get a job (he could have been lying too, who knows). Just keep in mind that an early retirement may hinder getting another job when going back into the workforce.


Edit: I commented after posting this that I went down a mental rabbit hole that led me to post this after reading u/dmmagic’s post. That comment was buried so I figured I’d include this update.",491.0,financialindependence
123,Has anyone had to address their own negative mindset in order to enjoy life and especially work more?,,1181.0,g3osfd,https://www.reddit.com/r/financialindependence/comments/g3osfd/has_anyone_had_to_address_their_own_negative/,1587221785.0,"As titled really, I'm in a really privileged position in terms of work, nothing insane but given the current climate I'm safe and secure at least.

Despite this, I'm really struggling to motivate myself at work.  I do not enjoy the job and will eventually leave for numerous reasons, but there's lessons for me to learn where I am right now.  I should be able to be content, no matter what the situation, especially given my life circumstance.  I'd love to improve my mindset to be more positive and continue getting my work done in a playful/curious headspace.  I know this, yet I still procrastinate FAR too much and moreso than I used to.

Years ago, I was plenty happy stacking shelves at a supermarket, right now I make a lot more, though there are more demands on my time at work and at home.

TLDR - I've the potential to be content where I am and bring playfulness/curiosity to everything I do.  I need to work several more years until FI.  I'm aware of this, yet I'm not doing it.  How do I change this?  Has anyone achieved similar before?",253.0,financialindependence
124,The fallacy of buying stocks on the way down,,1178.0,kgxe9x,https://www.reddit.com/r/financialindependence/comments/kgxe9x/the_fallacy_of_buying_stocks_on_the_way_down/,1608483142.0,"In yesterday's [thread about timing the market](https://old.reddit.com/r/financialindependence/comments/kg7mym/i_graphed_out_all_the_guesses_from_the_contest_to/) there were a lot of people who talked about buying stocks on the way down, either towards the end of the drop or throughout the drop. 

This leaves out one important thing: They *had* money to put into the market on the way down. If so, that also means they didn't have that money in the market *on the way up*.

Once you have your allocation set (e.g. 80% stocks / 10% bonds / 10% cash), you should stick to that allocation. Sacrificing your cash position (or worse, your emergency fund) to buy more stocks could work out well, but it could be a disaster too. And if you had extra cash just sitting around that was available to buy stocks, then you almost certainly missed the chance to use that cash in the run-up before the drop.

Don't time the market. Choose your allocation and stick to it. Dollar Cost Averaging is fine, but that should be an automatic process that is independent of what the market is doing.",297.0,financialindependence
125,The 7 Rules of Money,,1150.0,f169o2,https://www.reddit.com/r/financialindependence/comments/f169o2/the_7_rules_of_money/,1581239150.0,"**1 - Fools and their money are soon parted:**

In the digital landscape, you will see many people selling courses. To put it bluntly, the three so called evergreen niches are generally: 'how to get rich quick', 'how to attract a supermodel partner using THIS specific pick up routine', and 'how to get a six pack in six weeks'.

This is a simplification but is not far off the mark.

Of course, there are some experts in certain fields providing specific and high quality information at a reasonable price - but this is the exception rather than the rule.

Possibly the most lucrative evergreen niche is ""How to Get Rich Quick"" and by the way this is not a new phenomenon - it has been going on for many years before the Internet.

However, the scale provided by the Internet means that it is more lucrative today than ever.

For example, if you are selling a $1000 course, you need to sell 1000 courses to generate a revenue of $1MM. You have to give a chunk to Uncle Sam, or you can set up shop in a more tax friendly nation if you are not an American citizen.

Using ad campaigns on social media platforms like Facebook and YouTube and getting it out to millions of people, you can see why some have raked in the cash by selling thousands of these courses.

So remember that just like the Wild West, there are many scammers who want to part you from your money. If it sounds too good to be true, it is.

**2 - Understand what money is:**

Money of course has specific characteristics, but to simplify money is just the mechanism by which we transfer time and wealth. Provide value at scale by applying leverage (code, people, capital) and you will become rich.

**3 - Money can't buy happiness:**

Having enough money to be financially independent and avoiding financial stress *is* important though - studies have actually shown that financial stress can temporarily lower IQ. Not good.

In terms of happiness, some prefer to view it using the lens of excitement = happy, and boredom = sadness. This is generally more practical, as doing things that you enjoy and are aligned with some sort of purpose leads to a greater level of fulfilment (or happiness).

**4 - Beware of the Diderot Effect:**

In the words of Warren Buffett:

""If you spend money on things you do not need, soon you will have to sell things you need.""

Now, we can probably think back to numerous occasions where we've bought something, and cringe thinking about how unnecessary the purchase was, and more importantly what he true opportunity cost is if it had of been invested instead.

We of course live in a consumer driven culture, whereby material possessions are the Holy Grail of one's achievement in life. This is starting to shift with the emergence of trends such as minimalism and FIRE, but it is still prevalent in popular culture and advertising.

In terms of consumer goods, there is an interesting social phenomenon called the Diderot Effect.

It is named after the French philosopher Denis Diderot.

Diderot was the co-founder and writer of Encyclopédie, one of the most comprehensive encyclopedias of the time.

Diderot lived in poverty for most of his life, but all that changed in 1765 Catherine the Great, the Empress of Russia, heard of Diderot’s financial troubles and offered to buy his library from him for £1000 GBP (which is the equivalent of around £178K today).

Suddenly, at the age of 52, Diderot had money to spare.

He acquired a new scarlet robe. And that's when the spiral began...

He noticed this is beautiful robe was out of place when surrounded by the rest of his common possessions.

According to Diderot, there was “no more coordination, no more unity, no more beauty” between his robe and the rest of his items.

He felt the urge to buy some new things to match the beauty of his robe. He replaced his old rug with a new one from Damascus. He decorated his home with beautiful sculptures and a better kitchen table. He bought a new mirror to place above the mantle and his “straw chair was relegated to the antechamber by a leather chair.”

These reactive purchases have become known as the Diderot Effect.

The Diderot Effect states that obtaining a new possession often creates a spiral of consumption which leads you to acquire more new things. As a result, we end up buying things that our previous selves never needed to feel happy or fulfilled.

This spiral of consumption is one of the reasons why many former Sports stars go broke after they retire. When they got their big break and signed their first contract, they had more money than they knew what to do with. Then, they buy a huge mansion with a colossal mortgage and numerous Super-cars. Their lifestyle expenses then inflate to obscene levels such that once they retire and lose their main income source, they go broke. They were rich, but they weren't wealthy.

**5 - Avoid the Lifestyle Inflation Trap:**

Speaking of lifestyle inflation, this applies to mere mortals and not the Sports stars we see on TV.

In his best seller The Four Hour Work Week, Tim Ferriss, examines the concept of 'the New Rich'.

The essence is the following: ""Who is better off: the person on $40K per year but working 30 hours a week, living well within their means, investing aggressively and spending the rest of their time pursuing other passions, or the Investment Banker on $400K working 100 hours a week, sacrificing their long term health, and living a very expensive lifestyle."" Of course, this is a simplified example: the Investment Banker could of course come from a wealthy family and have an eight figure inheritance, there are exceptions - but generally lifestyle inflation is a trap and something to watch out for.

**6 - Money is not necessarily the root of all evil:**

It is possible to make a lot of money ethically - you don't *have* to turn into a super villain to obtain it (although it does help!). But if you view money as evil, it will probably elude you forever.

Money just exacerbates what type of person you naturally are.

If you a decent person without lots of money, at your core, you're still a decent person in the long term with lots of money. In the short term you may see some people change for worse, but over the long term you'll find they're fairly consistent.

If you are a...not so decent person without lots of money, you'll still be a not so decent person with lots of money.

Also, unless someone is a genuine psychopath, humans are generally not completely ""evil"" or ""good"" anyway - it is a complex and dynamic situation, where the very definitions of good and evil vary depending on culture and period in history.

So, don't view money as completely evil, otherwise it may prove elusive.

**7 - Remember the Goal is Wealth:**

Finally, something that the wealthiest individuals understand, is that money is emotionless. It doesn't care how hard you work, it doesn't care about the sacrifices you make to obtain it, it doesn't even care if you don't buy avocado toast, it has no emotion.

It is more about realising that the real goal is to acquiring assets and diversifying to create genuine wealth, and having sufficient cash flow to maintain whatever sort of lifestyle you prefer.

Indefinitely.",110.0,financialindependence
126,It is okay to not achieve FIRE,,1135.0,havzni,https://www.reddit.com/r/financialindependence/comments/havzni/it_is_okay_to_not_achieve_fire/,1592415370.0,"Writing this more for myself as a therapeutic outlet but as a 25-year-old on the quest for FIRE, it can all be very daunting. There are ups and downs, salary fluctuations, job loss, career rut, unexpected expenses, lifestyle changes, the possible marriage which means possible kids, and the everchanging spreadsheet where your assumptions can change monthly/yearly. 

I have been trying to tell myself lately that it is OKAY to not achieve FIRE. Not achieving FIRE by age 45 for 50 doesn't make you a failure. More than likely, you will have more money saved than most people and the financial pressure will be lightened. If the pandemic has taught me anything it is that a lot of people live paycheck to paycheck and even having a little bit of a nest egg has given me some peace of mind. I am grateful for that. I see a lot of people on this sub get down on themselves (myself included) when they see what people are making, how far along they are at a certain age, and free vacations they get with credit card churning or whatever bullshit personal finance hack they are doing. Try and keep everything in perspective. Survivor bias exists more on this sub than people think. 

As long as you are conscious of your finances and at least thinking about your future and doing small steps to get there....you are doing better than most people in the world. It is not worth constantly thinking you are behind or ""Will I ever achieve FIRE in 30 years?"" This process is a grind and even if you fall short of the goal, you will still be alright. At least that is what I am telling myself. Take the trip that you want to go on, eat a nice meal out with friends, buy the more expensive toy for your hobby. Live your life the way you want.",202.0,financialindependence
127,A different way to think about your FIRE number,,1134.0,hdvy9v,https://www.reddit.com/r/financialindependence/comments/hdvy9v/a_different_way_to_think_about_your_fire_number/,1592844661.0,"A topic I see come up regularly in this sub is about how a mindset shift can have a drastic change on behaviors and happiness. Related to that, I'd like to share how I think about my FIRE goal.

For a metaphor, I recently had to do a 24 hour drive. That's a long drive. I could break it up into 2 days, 3 day, or hell, I could muscle through it and drive for 24 hours straight. Most people wouldn't recommend the last option, but it does allow you to reach your goal the fastest. So what I did for my drive is establish ""checkpoints"". As I reached major cities, I did a sanity check to see if I'm alert enough to continue driving.

I'm trying to take the same approach with my FIRE goal. While the end goal to my drive was reaching the destination, the goal with FIRE is to be financially independent. The journey to FI can look very different - it appears that everyone is trying to plan ahead exactly what that journey looks like. My proposal is to play it by ear. I have NW ""checkpoints"" where my goal is to re-evaluate my path at each turn.

\-When I reach $500k NW, I could consider a less stressful job where I don't continue to save as much, but elect to have a longer career. Maybe barista FIRE is right for me at this point. Or I can keep pushing along at full speed.

\-If I continue along at full speed, I'll keep going the course until I reach $1MM. At this point, could I lean/barista FIRE? Could I reduce my workload? Maybe start investing more heavily in real estate and become a full time landlord? Or have things gotten better in my current environment to where I'm okay with continuing on my drive?

&#x200B;

This doesn't change anything fundamentally outside of your mindset. Doing this way allows you to stop fixating on how many years of grinding your job remains, because there is no set number of years anymore. That fixation can be unhealthy and make you hate your job even more.  Just keep driving down the highway - when you're capable of taking a pit stop, you can decide then if you need to take a piss or nap.

If you asked me what my FIRE number is, the honest answer is ""I don't know."" But that doesn't mean I'm not properly forecasting or preparing for my future. I just find it less stressful to not get fixated on a specific end goal. We're in the middle of a long journey, stop kicking my seat and asking me ""are we there yet?""

&#x200B;

Edit: I highly recommend reading through the comments. Some people bring up great points to add to this discussion. Some people asked great questions to which I expanded my thoughts on a little. The most important thing that came up is that your checkpoints don't need to be based on net worth. They should be milestones that are meaningful to your financial future - new promotion, burnt out from work, family member gets ill, have a child, etc. The important aspect is that you don't treat FIRE as a straight line, obsession doesn't get you there any faster. Everyone's path is going to evolve overtime, make sure you're in the right position to adapt to those evolutions. ",264.0,financialindependence
128,Non fire people tend to get upset and defensive at our financial perspectives.,,1132.0,ktfo8x,https://www.reddit.com/r/financialindependence/comments/ktfo8x/non_fire_people_tend_to_get_upset_and_defensive/,1610151670.0,"To start, I really don't talk finances with people. Once in a while I do add my thoughts on a convo. 

The idea that you can live comfortably without over consuming, by saving/investing, by creating additional income and deferring some gratification has put people in to a state of shock.


Does anyone else run in to this?

Edit: Looks like it's worth clarifying, these interactions stem from friends/family divulging their financial hardships, not proactively offering advice or telling them how they should spend their $.",1128.0,financialindependence
129,How much of your net worth do you attribute to luck/privilege? How much do you attribute to responsibility/discipline?,,1112.0,kashae,https://www.reddit.com/r/financialindependence/comments/kashae/how_much_of_your_net_worth_do_you_attribute_to/,1607649668.0,"In this article written by Emma Panttee she says, “Being frugal and working hard may have saved me some money — a lot of money —  but frugality is not what enabled me to be financially independent. I owe my financial independence almost entirely to being lucky and being advantaged.” 

https://thefinancialdiet.com/why-i-joined-then-left-the-fire-movement/?fbclid=IwAR0YJkcnXriDXEaIfZky2vDYdclw_qjQHizBrpW_lJbVvCChV94vQHbN9hM",1131.0,financialindependence
